{
  "$schema": "https://raw.githubusercontent.com/T-Auto/dsh-std/8a15541117cb3c13ddb8f2468308691b6051d162/packages/manifest/schema/dsh-plugin-0.15.schema.json",
  "manifestVersion": "0.15",
  "id": "read-figure.tool",
  "name": "read-figure",
  "version": "0.1.0",
  "license": "MIT",
  "facets": {
    "host": {
      "entry": "lib/index.mjs",
      "apiVersion": "v1alpha1"
    }
  },
  "requires": {
    "contracts": [
      {
        "apiVersion": "tools.dsh/v1alpha1",
        "kind": "Tool"
      }
    ]
  },
  "permissions": [
    {
      "name": "read-figure.net.vision",
      "scope": "network",
      "reason": "Send the named image file to the configured OpenAI-compatible vision endpoint (default https://api.deepseek.com) and read back its description. This is the plugin's entire function; the destination is config.baseUrl."
    },
    {
      "name": "read-figure.fs.read",
      "scope": "filesystem-read",
      "reason": "Read the image file the caller names, the bundled handoff protocol, and — when an environment variable is absent — the API key from the DSH credentials file. No directory is enumerated."
    },
    {
      "name": "read-figure.fs.write",
      "scope": "dsh-home",
      "reason": "Only when the caller passes outPath or writeHandoff is enabled: write the handoff Markdown into config.handoffDir. Without those the plugin writes nothing."
    }
  ],
  "contributes": {
    "x-display": [
      {
        "icon": "./icon.svg",
        "title": "read-figure",
        "description": "Let a text-only model read a figure: a vision model transcribes the image into a three-part handoff, uncertainty included, before the plain-text model reasons about it.",
        "locales": [
          "locale/en.json",
          "locale/zh.json"
        ]
      }
    ],
    "x-tool-namespaces": [
      {
        "serverName": "read-figure",
        "transport": "in-process",
        "source": "lib/index.mjs via ctx.tools.register, with prompts/figure-handoff.zh.md as the protocol asset",
        "publicPrefix": "",
        "tools": [
          "read_figure"
        ],
        "shellPermission": "No shell. One outbound HTTPS request per call to config.baseUrl, cancellable through exec.signal."
      }
    ]
  },
  "subscriptions": [],
  "source": {
    "repository": "https://github.com/Amethyst-Leafs/dsh-read-figure"
  }
}
